,0,1,2
111,Metallica,Disposable Heroes,"Bodies fill the fields I see, hungry heroes end  
No one to play soldier now, no one to pretend  
Running blind through killing fields, bred to kill them all  
Victim of what said should be  
A servant 'til I fall  
  
Soldier boy, made of clay  
Now an empty shell  
Twenty one, only son  
But he served his will  
Bred to kill, not to care  
Do just as we say  
Finished here, greetings death  
He's yours to take away  
  
Back to the front  
You will do what I say, when I say  
Back to the front  
You will die when I say, you must die  
Back to the front  
You coward  
You servant  
You blind man  
  
Barking of machine gun fire, does nothing to me now  
Sounding of the clock that ticks, get used to it somehow  
More a man, more stripes you bare, glory seeker trends  
Bodies fill the fields I see  
The slaughter never ends  
  
Soldier boy, made of clay  
Now an empty shell  
Twenty one, only son  
But he served us well  
Bred to kill, not to care  
Do just as we say  
Finished here, greetings death  
He's yours to take away  
  
Back to the front  
You will do what I say, when I say  
Back to the front  
You will die when I say, you must die  
Back to the front  
You coward  
You servant  
You blind man  
  
Why, am I dying?  
Kill, have no fear  
Lie, live off lying  
Hell, hell is here  
  
I was born for dying  
  
Life planned out before my birth, nothing could I say  
Had no chance to see myself, molded day by day  
Looking back I realize, nothing have I done  
Left to die with only friend  
Alone I clench my gun  
  
Soldier boy, made of clay  
Now an empty shell  
Twenty one, only son  
But he served his will  
Bred to kill, not to care  
Do just as we say  
Finished here, greetings death  
He's yours to take away  
  
Back to the front  
You will do what I say, when I say  
Back to the front  
You will die when I say, you must die  
Back to the front  
You coward  
You servant  
You blind man  
  
Back to the front

"
112,Metallica,Don't Tread On Me,"Liberty or death, what we so proudly hail  
Once you provoke her, rattling of her tail  
Never begins it, never, but once engaged  
Never surrenders, showing the fangs of rage  
Don't tread on me  
  
So be it  
Threaten no more  
To secure peace is to prepare for war  
So be it  
Settle the score  
Touch me again for the words that you'll hear evermore  
Don't tread on me  
  
Love it or leave it, she with the deadly bite  
Quick is the blue tongue, forked as lighting strike  
Shining with brightness, always on surveillance  
The eyes, they never close, emblem of vigilance  
Don't tread on me  
  
So be it  
Threaten no more  
To secure peace is to prepare for war  
So be it  
Settle the score  
Touch me again for the words that you'll hear evermore  
  
Don't tread on me  
So be it  
Threaten no more  
To secure peace is to prepare for war  
Liberty or death, what we so proudly hail  
Once you provoke her, rattling on her tail  
  
So be it  
Threaten no more  
To secure peace is to prepare for war  
So be it  
Settle the score  
Touch me again for the words that you'll hear evermore  
Don't tread on me

"
113,Metallica,Dream No More,"He sleeps under black seas waiting  
Lies dreaming in death  
He sleeps under cosmos shaking  
Stars granting his breath  
  
He wakes as the world dies screaming  
All horrors arrive  
He wakes giving earth its bleeding  
Pure madness alive  
  
And He haunts you  
And He blinds your soul  
And He loathes you  
And reclaims it all  
  
You turn to stone  
Can't look away  
You turn to stone  
Madness, they say  
  
Cthulhu awaken  
  
He sways in abyss returning  
Inhaling black skies  
He shakes with a torture burning  
All lost in his eyes  
  
And He haunts you  
And He blinds your soul  
And He loathes you  
And reclaims it all  
  
You turn to stone  
Can't look away  
You turn to stone  
Madness, they say  
  
Cthulhu awaken  
  
You turn to stone  
Can't look away  
You turn to stone  
Madness, they say  
  
Sanity taken  
Seething damnation  
Cthulhu awaken  
(Wake) Winged Salvation  
Death by creation  
Cthulhu, awaken  
(Wake) Dreaming no more  
  
Cthulhu, awaken  
(Wake) Dreaming no more  
Cthulhu, awaken  
(Wake) Dreaming no more

"
114,Metallica,Dyers Eve,"Dear mother  
Dear father  
What is this hell you have put me through  
Believer  
Deceiver  
Day in day out live my life through you  
Pushed onto me what's wrong or right  
Hidden from this thing that they call life  
  
Dear mother  
Dear father  
Every thought I'd think you'd disapprove  
Curator  
Dictator  
Always censoring my every move  
Children are seen but are not heard  
Tear out everything inspired  
  
Innocence  
Torn from me without your shelter  
Barred reality  
I'm living blindly  
  
Dear mother  
Dear father  
Time has frozen still what's left to be  
Hear nothing  
Say nothing  
Cannot face the fact I think for me  
No guarantee, it's life as is  
But damn you for not giving me my chance  
  
Dear mother  
Dear father  
You've clipped my wings before I learned to fly unspoiled  
Unspoken  
I've outgrown that fucking lullaby  
Same thing I've always heard from you  
Do as I say not as I do  
  
Innocence  
Torn from me without your shelter  
Barred reality  
I'm living blindly  
  
I'm in hell without you  
Cannot cope without you two  
Shocked at the world that I see  
Innocent victim please rescue me  
  
Dear mother  
Dear father  
Hidden in your world you've made for me  
I'm seething  
I'm bleeding  
Ripping wounds in me that never heal  
Undying spite I feel for you  
Living out this hell you always knew

"
115,Metallica,Enter Sandman,"Say your prayers little one  
Don't forget, my son  
To include everyone  
  
Tuck you in, warm within  
Keep you free from sin  
Till the sandman he comes  
  
Sleep with one eye open  
Gripping your pillow tight  
  
Exit, light  
Enter, night  
Take my hand  
We're off to never-never land  
  
Somethings wrong, shut the light  
Heavy thoughts tonight  
And they aren't of Snow White  
Dreams of war, dreams of liars  
Dreams of dragon's fire  
And of things that will bite  
  
Sleep with one eye open  
Gripping your pillow tight  
  
Exit, light  
Enter, night  
Take my hand  
We're off to never-never land  
  
Now I lay me down to sleep  
'Now I lay me down to sleep'  
I pray the Lord my soul to keep  
'I pray the Lord my soul to keep'  
If I die before I wake  
'If I die before I wake'  
I pray the lord my soul to take  
'I pray the lord my soul to take'  
  
Hush little baby, don't say a word  
And never mind that noise you heard  
It's just the beasts under your bed  
In your closet, in your head  
  
Exit, light  
Enter, night  
Grain of sand  
  
Exit, light  
Enter, night  
Take my hand  
We're off to never-never land  
  
Ooh yeah, Yeah!  
  
We're off to never-never land  
Take my hand  
We're off to never-never land  
Take my hand.

"
116,Metallica,Eye Of The Beholder,"Do you see what I see?  
Truth is an offense  
You silence for your confidence  
Do you hear what I hear?  
Doors are slamming shut  
Limit your imagination, keep you where they must  
Do you feel what I feel?  
Bittering distress  
Who decides what you express  
Do you take what I take?  
Endurance is the word  
Moving back instead of forward seems to me absurd  
  
Doesn't matter what you see?  
Or intuit what you read  
You can do it your own way  
If it's done just how I say  
  
Independence limited  
Freedom of choice  
Choice is mad for you my friend  
Freedom of speech  
Speech is words that they will bend  
Freedom with their exception  
  
Do you fear what I fear?  
Living properly  
Truths to you are lies to me  
Do you choose what I choose?  
More alternatives  
Energy derives from both the plus and negative  
Do you need what I need?  
Boundaries overthrown  
Look inside to each his own  
Do you trust what I trust?  
Me, myself and I  
Penetrate the smoke screen I see through the selfish lie  
  
Doesn't matter what you see  
Or intuit what you read  
You can do it your own way  
If it's done just how I say  
  
Independence limited  
Freedom of choice  
Choice is mad for you my friend  
Freedom of speech  
Speech is words that they will bend  
Freedom with their exception  
  
Do you know what I know?  
Your money end your wealth  
Your silence just to hear your self  
Do you want what I want?  
Desire not a thing  
I hunger after independence lengthen freedom's ring  
  
Doesn't matter what you see  
Or intuit what you read  
You can do it your own way  
If it's done just how I say  
  
Independence limited  
Freedom of choice  
Choice is mad for you my friend  
Freedom of speech  
Speech is words that they will bend  
Freedom no longer frees you  
  
Doesn't matter what you see  
Or intuit what you read  
You can do it your own way  
If it's done just how I say

"
117,Metallica,Fade To Black,"Life it seems will fade away  
Drifting further everyday  
Getting lost within myself  
Nothing matters no one else  
I have lost the will to live  
Simply nothing more to give  
There is nothing more for me  
Need the end to set me free  
  
Things not what they used to be  
Missing one inside of me  
Deathly loss this can't be real  
Can't stand this hell I feel  
Emptiness is filling me  
To the point of agony  
Growing darkness taking dawn  
I was me but now, he's gone  
  
No one but me can save myself, but it's too late  
Now I can't think, think why I should even try  
  
Yesterday seems as though it never existed  
Death greets me warm, now I will just say goodbye  
Goodbye

"
118,Metallica,Fight Fire With Fire,"Do unto others as they have done unto you  
But what in the hell is this world coming to?  
  
Blow the universe into nothingness  
Nuclear warfare shall lay us to rest  
  
Fight fire with fire  
Ending is near  
Fight fire with fire  
Bursting with fear  
  
We shall die  
Time is like a fuse, short and burning fast  
Armageddon is here, like said in the past  
  
Fight fire with fire  
Ending is near  
Fight fire with fire  
Bursting with fear  
  
Soon to fill our lungs the hot winds of death  
The gods are laughing, so take your last breath  
  
Fight fire with fire  
Ending is near  
Fight fire with fire  
Bursting with fear  
  
Fight fire with fire

"
119,Metallica,For Whom The Bell Tolls,"Make his fight on the hill in the early day  
Constant chill deep inside  
Shooting gun, on they run through the endless grey  
On they fight, for the right, yes, but who's to say?  
For a hill men would kill, why? They do not know  
Suffered wounds test their pride  
Men of five, still alive through the raging glow  
Gone insane from the pain that they surely know  
  
For whom the bell tolls  
Time marches on  
For whom the bell tolls  
  
Take a look to the sky just before you die  
It is the last time he will  
Blackened claw massive roar fills the crumbling sky  
Shattered goal fills his soul with a ruthless cry  
Stranger now, are his eyes, to this mystery  
He hears the silence so loud  
Crack of dawn, all is gone except the will to be  
Now they see what will be, blinded eyes to see  
  
For whom the bell tolls  
Time marches on  
For whom the bell tolls

"
120,Metallica,Halo On Fire,"Obey, obey  
Come won't you stay  
Sincere, sincere  
All ends in tears  
Endure, endure  
Thoughts most impure  
Concede, concede  
But both shall we bleed  
  
Oh, Halo on fire  
The midnight knows it well  
Fast, is desire  
Creates another hell  
I fear to turn on the light  
For the darkness won't go away  
Fast, is desire  
Turn out the light  
Halo on fire  
  
Allure, allure  
Sweetness obscure  
Abide, abide  
Secrets inside  
Deprive, deprive  
To feel so alive  
Obey, obey  
Just don't turn away  
  
Oh, Halo on fire  
The midnight knows it well  
Fast, is desire  
Creates another hell  
I fear to turn on the light  
For the darkness won't go away  
Fast, is desire  
Turn out the light  
Halo on fire  
  
Prayers cannot get through  
Return to sender  
Unto which of you  
Shall I surrender  
Twisting in disguise  
Dark resurrection  
Lighting up the skies  
Wicked perfection  
  
Too dark to sleep  
Can't slip away  
Open or close  
My eyes betray  
Beyond the black  
Come won't you stay  
  
Hello darkness, say goodbye  
Hello darkness, say goodbye  
Hello darkness, say goodbye

"
121,Metallica,Here Comes Revenge,"Little grave I'm grieving, I will mend you  
Sweet revenge I'm dreaming, I will end you  
  
I've been here since dawn of time  
Countless hatreds built my shrine  
I was born in anger's flame  
He was Abel, I was Cain  
I am here  
I'm hell unbound  
Burn your kingdom to the ground  
To the ground  
  
Here comes revenge, just for you  
Revenge, you can't undo  
Revenge, it's killing me  
Revenge, set me free  
Eye for an eye, tooth for a tooth  
A life for a life, it's my burden of proof  
Revenge, just for you  
Revenge  
You ask forgiveness, I give you sweet revenge  
  
I return this nightmare, I will find you  
Sleepless, cloaked in despair, I'm behind you  
  
Man has made me oh so strong  
Blurring lines of right and wrong  
Far too late for frail amends  
Now it's come to sweet revenge  
Desperate hands  
That lose control  
Have no mercy on your soul  
On your soul  
  
Here comes revenge, just for you  
Revenge, you can't undo  
Revenge, is killing me  
Revenge, set me free  
Eye for an eye, tooth for a tooth  
A life for a life, it's my burden of proof  
Revenge, just for you  
Revenge  
You ask forgiveness, I give you sweet revenge  
  
Here comes revenge, just for you  
Revenge, you can't undo  
Revenge, is killing me  
Revenge, set me free  
Eye for an eye, tooth for a tooth  
A life for a life, it's my burden of proof  
Revenge, just for you  
Revenge  
You ask forgiveness, I give you sweet revenge  
  
Sweet revenge

"
122,Metallica,Hit The Lights,"No life till leather  
We are gonna kick some ass tonight  
We got the metal madness  
When our fans start screaming  
It's right well alright  
When we start to rock  
We never want to stop again  
  
Hit the lights  
Hit the lights  
Hit the lights  
  
You know our fans are insane  
We are gonna blow this place away  
With volume higher  
Than anything today the only way  
When we start to rock  
We never want to stop again  
  
Hit the lights  
Hit the lights  
Hit the lights  
  
With all our screaming  
We are gonna rip right through your brain  
We got the lethal power  
It is causing you sweet pain Oh sweet pain  
When we start to rock  
We never want to stop again  
  
Hit the lights  
Hit the lights  
Hit the lights

"
123,Metallica,Holier Than Thou,"No more!  
The craps rolls out your mouth again  
Haven't changed, your brain is still gelatin  
Little whispers circle around your head  
Why don't you worry about yourself instead  
Who are you? where ya been? where ya from?  
Gossip is burning on the tip of your tongue  
You lie so much you believe yourself  
Judge not lest ye be judged yourself  
  
Holier than thou  
You are  
Holier than thou  
You are  
You know not  
Before you judge me take a look at you  
Can't you find something better to do  
Point the finger, slow to understand  
Arrogance and ignorance go hand in hand  
It's not who you are it's who you know  
Others lives are the basis of your own  
Burn your bridges build them back with wealth  
Judge not lest ye be judged yourself  
  
Holier than thou  
You are  
Holier than thou  
You are  
You know not

"
124,Metallica,House Jack Built,"Open doors so I walk inside  
Close my eyes find my place to hide  
And I shake as I take it in  
Let the show begin  
Open my eyes  
Just to have them close again  
Well on my way  
On my way to where I graze  
It swallows me  
As it takes me in his home  
I twist away  
As I kill this world  
Open doors so I walk inside  
Close my eyes find my place to hide  
And I shake as I take it in  
Let the show begin  
Open my eyes  
Just to have them close once again  
Don't want control  
As It takes me down and down again  
Is that the moon  
Or just a light that lights this dead end street?  
Is that you there  
Or just another demon that I meet?  
The higher you are  
The farther you fall  
The longer the walk  
The farther you crawl  
My body my temple  
This temple it tells  
""Step into the house that Jack built""  
The higher you walk  
The farther you fall  
The longer the walk  
The farther you crawl  
My body my temple  
This temple it tells  
""Yes this is the house that Jack built""  
Open doors as I walk inside  
Swallow me so the pain subsides  
And I shake as I take this in  
Let the show begin  
The higher you are  
The farther you fall  
The longer the walk  
The farther you crawl  
My body my temple  
This temple it tells  
""Yes this is the house that Jack built""  
The higher you walk  
The farther you fall  
The longer the walk  
The farther you crawl  
My body my temple  
This temple it tells  
""Yes I am I am I am""  
Open my eyes  
It swallows me  
Is that you there  
I twist away  
Away  
Away  
Away

"
125,Metallica,I Disappear,"Hey, hey, hey  
Here I go now  
Here I go into new days  
Hey, hey, hey  
Here I go now  
Here I go into new days  
I'm pain, I'm hope, I'm suffer  
Yeah, hey, hey, hey, yeah, yeah  
Here I go into new days  
  
Hey, hey, hey  
Ain't no mercy  
Ain't no mercy there for me  
Hey, hey, hey  
Ain't no mercy  
Ain't no mercy there for me  
I'm pain, I'm hope, I'm suffer  
Yeah, yeah, hey, hey no mercy  
Ain't no mercy there for me  
  
Do you bury me when I'm gone  
Do you teach me while I'm here  
Just as soon as I belong  
Then it's time I disappear  
Ha!  
  
Hey, hey, hey  
And I went  
And I went on down that road  
Hey, hey, hey  
And I went on  
And I went on down that road  
I'm pain, I'm hope, I'm suffer  
Hey, hey, hey, yeah, and I went on  
And I went on down that road  
  
Do you bury me when I'm gone  
Do you teach me while I'm here  
Just as soon as I belong  
Then it's time I disappear  
  
Do you bury me when I'm gone  
Do you teach me while I'm here  
Just as soon as I belong  
Then it's time I disappear  
Disappear, huh!  
  
I'm gone, I'm gone  
I'm gone  
Oh yeah, I'm gone  
I'm gone  
I'm gone baby  
I'm gone, I'm gone  
  
Do you bury me when I'm gone  
Do you teach me while I'm here  
Just as soon as I belong  
Then it's time I disappear  
  
Do you bury me when I'm gone  
Do you teach me while I'm here  
Just as soon as I belong  
Then it's time I disappear  
Disappear.

"
126,Metallica,Iced Honey,"You can't put a butterfly in a jar  
If the effort's too high no matter who you are  
You can't catch the moon, or the sun or the stars  
It doesn't matter who you are  
Iced honey, iced honey  
  
Now me I've tried a million tricks  
To make life cold and make it stick  
Not running heat that flames then out  
But the proud piece of ice that always floats  
Iced honey, iced honey  
  
If I can't trap a butterfly or a bee  
If I can't keep my heart where I want it to be  
If no matter how much soul and heart  
I put to the wood  
If a flaming heart is not that good  
Iced honey, iced honey  
  
If you can't put a butterfly in a jar  
If violence mars your final hour  
If you make others feel like jam  
Poured on a piece of charbroiled lamb  
  
If it's all mixed up and you cannot shout  
And your oxygen starts to run out  
If your final gasp has the recipe wrong  
And instead of hello you say so long  
If your energy starts to leak out  
And people wonder what you're all about  
A heartbreaker with an unattached heart  
The story of love gives them all a start  
  
And me, I've always been this way  
Not by choice, just this way  
I can't put my honey pot in a jar  
Or a heart or a fist of some young boy  
  
If you can't put a butterfly in a jar  
No wonder no need to wonder where you are  
It might seem like hell, the River Styx  
Your affection never sticks  
  
No matter what you say, no matter what you do  
A butterfly heart flies right past you  
There's nothing to say, nothing to do  
See if the ice will melt for you  
See if the ice will melt for you  
See if the ice will melt for you  
See if the ice will melt for you  
See if the ice will melt for you  
Iced honey, ah ah ah iced honey  
Iced honey, iced honey  
See if the ice will melt for you  
See if the ice will melt for you  
See if the ice will melt for you  
See if the ice will melt for you  
Iced honey, iced honey  
Oh iced honey  
See if the  
See if the ice will melt for you  
Iced honey  
Iced honey

"
127,Metallica,Invisible Kid,"Invisible kid  
Never see what he did  
Got stuck where he hid  
Fallen through the grid  
  
Invisible kid  
Got a place of his own  
Where he'll never be known  
Inward he's grown  
  
Invisible kid  
Locked away in his brain  
From the shame and the pain  
World down the drain  
  
Invisible kid  
Suspicious of your touch  
Don't want no crutch  
But it's all too much  
  
I hide inside  
I hurt inside  
I hide inside  
But I'll show you...  
  
I'm ok, just go away  
Into distance let me fade  
I'm ok, just go away  
I'm ok, but please don't stray too far  
  
Open your heart  
I'm beating right here  
Open your mind  
I'm being right here, right now (x2)  
  
Invisible kid  
Never see what he did  
Got stuck where he hid  
Fallen through the grid  
  
Invisible kid  
Got a place of his own  
Where he'll never be known  
Inward he's grown  
  
I hide inside  
I hurt inside  
I hide inside  
But I'll show you...  
  
I'm ok, just go away  
Into distance let me fade  
I'm ok, just go away  
I'm ok, but please don't stray too far  
  
Open your heart  
I'm beating right here  
Open your mind  
I'm being right here, right now (x2)  
  
Oooh, what a good boy you are  
Out of the way and you're kept to yourself  
Oooh, can't you see that he's not here?  
He doesn't want the attention you give  
Oooh, unplugging from it all  
Invisible kid, floats alone in his room  
Oooh, what a quiet boy you are  
He looks so calm floating 'round and around in himself  
  
Invisible kid  
Locked away in his brain  
From the shame and the pain  
World down the drain  
  
Invisible kid  
Suspicious of your touch  
Don't want no crutch  
But it's all too much  
  
I hide inside  
I hurt inside  
I hide inside  
But I'll show you...  
  
I'm ok, just go away  
Into distance let me fade  
I'm ok, just go away  
I'm ok, but please don't stray too far  
  
Open your heart  
I'm beating right here  
Open your mind  
I'm being right here, right now (x2)

"
128,Metallica,It's Electric,"(Originally recorded by Diamond Head)  
  
I'm gonna be a rock'n'roll star  
Gotta groove from night to day  
Gotta blow my crumby job  
Gotta blow my blues away  
  
I'm gonna make a stand  
Gonna make a million  
Gonna make it with you  
I'm gonna be right my friend  
I'm gonna push it through, ooh, oh, yeah  
  
It's electric  
It's electric, yeah  
It's electric, yeah  
It's electric, oo-ooh, yeah  
  
I stop on red, but I leave on amber, danger face my way  
I'm gonna make it my friend  
Gonna make it today  
Gotta get this dust from my hills down the highway I go  
Gotta get the stars from my route  
Make it in a rock'n'roll show, oo-ooh, yeah, yeah  
  
It's electric  
It's electric, yo  
It's electric, yeah  
It's electric, wo-oh  
  
I stop on red, but I leave on amber, danger face my way  
I'm gonna make it my friend  
Gonna make it today  
Gotta get the dust from my hills down the highway I go  
Gotta get the stars from my route  
Make it in a rock'n'roll show, ooh  
  
It's electric, yeah  
It's electric, yeah  
It's electric, yeah  
It's electric, yeah  
It's electric, yeah  
It's electric, yo, ooh, yeah

"
129,Metallica,Jump In The Fire,"Down in the depths of my fiery home  
The summons bell will chime  
Tempting you and all the earth  
To join our sinful kind  
There is a job to be done and I'm the one  
You people make me do it  
Now it is time for your fate and I won't hesitate  
To pull you down into this pit  
  
So come on  
Jump in the fire  
So come on  
Jump in the fire  
  
With hell in my eyes and with death in my veins  
The end is closing in  
Feeding on the minds of man  
And from their souls within  
My disciples all shout to search out  
And they always shall obey  
Follow me now my child not the meek or the mild  
But do just as I say  
  
So come on  
Jump in the fire  
So come on  
Jump in the fire  
  
Jump by your will or be taken by force  
I'll get you either way  
Trying to keep the hellfire lit  
I am stalking you as prey  
Living your life as me I am you you see  
There is part of me in everyone  
So reach down grab my hand walk with me through the land  
Come home where you belong  
  
So come on  
Jump in the fire  
So come on  
Jump in the fire

"
