,0,1,2
0,Metallica,2X4,"I'm gonna make you, shake you, take you  
I'm gonna be the one who breaks you  
Put the screws to ya my way  
Yeah, come on come on, come and make my day, make my day  
  
Got some hell to pay, I steal your thunder  
The joy of violent movements pulls you under  
Bite the bullet well hard  
Yeah, but I die harder, so go too far, too far  
Friction, fusion, retribution  
I can't hear ya, talk ta me (Friction, fusion)  
I can't hear ya so talk ta me (Retribution)  
I can't here ya, are you talkin' ta me? (Friction, fusion)  
I can't year ya, are you talkin' ta me? (Retribution)  
I can't hear ya, time ta meet my lord  
I can't hear ya, talk ta 2 by 4  
  
I'm gonna make you, shake you, take you  
I'm gonna be the one who breaks you  
Put the screws to ya my way  
Hey, come on come on, come and make my day, make my day  
Friction, fusion, retribution  
I can't hear ya, talk ta me (Friction, fusion)  
I can't hear ya, come talk ta me (Retribution)  
I can't here ya, are you talkin' ta me? (Friction, fusion)  
I can't year ya, are you talkin' ta me? (Retribution)  
I can't hear ya, time ta meet my lord  
I can't hear ya, talk ta 2 by 4  
  
Hey talk ta 2 by 4  
It don't take no more  
C'mon yeah  
C'mon  
  
C'mon, c'mon, talk to 2 by 4  
Talk to 2 by 4  
  
Friction, fusion, retribution  
I'm gonna make you talk to me (Friction, fusion)  
I'm gonna take you through, so talk to me (Retribution)  
I can't year ya, are you talkin' ta me? (Friction, fusion)  
I can't year ya, are you talkin' ta me? (Retribution)  
I can't hear ya, time ta meet my lord  
I can't hear ya, talk to, talk to 2 by 4  
She don't take no more'

"
1,Metallica,All Nightmare Long,"(One, two...)  
  
Luck runs out  
  
Crawl from the wreckage one more time  
Horrific memory twists the mind  
Dark, rutted (rugged?), cold and hard to turn  
Path of destruction, feel it burn  
  
Still life  
Incarnation  
Still life  
Infamy  
  
Hallucination  
Heresy  
Still you run  
What's to come?  
What's to be?  
  
'Cause we'll hunt you down without mercy  
Hunt you down all nightmare long  
Feel us breathe upon your face  
Feel our shift, every move we trace  
  
Hunt you down without mercy  
Hunt you down all nightmare long, yeah  
Luck runs...  
And you crawl out again  
But your luck runs out  
  
(One, two...)  
  
Luck runs out  
  
The light that is not light is here  
To flush you out with your own fear  
You hide, you hide  
But will be found  
Release your grip without a sound  
  
Still life  
Immolation  
Still life  
Infamy  
  
Hallucination  
Heresy  
Still you run  
What's to come?  
What's to be?  
  
'Cause we'll hunt you down without mercy  
Hunt you down all nightmare long  
Feel us breathe upon your face  
Feel our shift, every move we trace  
  
Hunt you down without mercy  
Hunt you down all nightmare long, yeah  
Luck runs...  
And you crawl out again  
But your luck runs out  
  
Then you crawl back in  
Into your obsession  
Never to return  
This is your confession  
  
Hunt you down without mercy  
Hunt you down all nightmare long  
Feel us breathe upon your face  
Feel our shift, every move we trace  
  
Hunt you down without mercy  
Hunt you down all nightmare long, yeah  
Luck runs...  
And you crawl out again  
But your luck runs out

"
2,Metallica,All Within My Hands,"All within my hands  
Squeeze it in, crush it down  
All with my hands  
Hold it dear, hold it suffocate  
  
All within my hands  
Love to death, smack you 'round and round and  
All within my hands  
Beware  
  
Love is control  
I'll die if I let go  
  
Hate me now  
Kill all within my hands  
Hate me now  
Crush all within my hands  
Squeeze all within my hands  
Choke all within my hands  
Hate me now  
Trap all within my hands  
Hurry up and hate me now  
Kill all within my hands  
  
All within my hands  
Take your fear, pump me up  
All within my hands  
Let you run, then I pull your leash  
  
All within my hands  
Under thumb, under to myself  
All within my hands  
Beware  
  
Love is control  
I'll die if I let go  
  
Hate me now  
Kill all within my hands  
Hate me now  
Crush all within my hands  
Squeeze all within my hands  
Choke all within my hands  
Hate me now  
Trap all within my hands  
Hurry up and hate me now  
Kill all within my hands again  
  
I'll die if I let go  
Control is love, love is control  
I'll fall if I let go  
Control is love, love is control  
  
I will only let you breathe  
My air that you receive  
Then we'll see if I let you love me  
  
Kill kill kill kill kill

"
3,Metallica,Battery,"Lashing out the action, returning the reaction  
Weak are ripped and torn away  
Hypnotizing power, crushing all that cower  
Battery is here to stay  
  
Smashing through the boundaries  
Lunacy has found me  
Cannot stop the battery  
Pounding out aggression  
Turns into obsession  
Cannot kill the battery  
  
Cannot kill the family  
Battery is found in me  
  
Battery  
  
Crushing all deceivers, mashing non-believers  
Never ending potency  
Hungry violence seeker, feeding off the weaker  
Breeding on insanity  
  
Smashing through the boundaries  
Lunacy has found me  
Cannot stop the battery  
Pounding out aggression  
Turns into obsession  
Cannot kill the battery  
  
Cannot kill the family  
Battery is found in me  
  
Battery  
  
Circle of destruction, hammer comes crushing  
Powerhouse of energy  
Whipping up a fury, dominating flurry  
We create the battery  
  
Smashing through the boundaries  
Lunacy has found me  
Cannot stop the battery  
Pounding out aggression  
Turns into obsession  
Cannot kill the battery  
  
Cannot kill the family  
Battery is found in me  
  
Battery

"
4,Metallica,Brandenburg Gate,"I would cut my legs and tits off  
When I think of Boris Karloff and Kinski  
In the dark of the moon  
It made me dream of Nosferatu  
Trapped on the isle of Doctor Moreau  
Oh wouldn't it be lovely  
  
Small town girl  
Small town girl  
Small town girl  
  
I was thinking Peter Lorre  
When things got pretty gory as I  
Crossed to the Brandenburg Gate  
I was feeling snappy perhaps I'd been napping  
As I just ate  
A following heart can tear you apart  
On a midnight to eight shift  
A graveyard romance can only give one chance  
As the tombstones weave and breathe  
  
Small town girl  
Small town girl  
  
Feeling happy when my heart got beating  
On a Sunday afternoon  
I dreamt of breezes going through the treeses  
And stars were still illumed  
I have three hearts that I keep apart  
Trying to relate  
To normal feelings and the nighttime reeling  
And some absinthe drunk so late  
  
Small town girl  
My small town girl  
  
The cook got drunk and all the whores they shrunk  
Onto the size of dessert plates  
But me I'm happy cause I got my little nappy  
And some opium to set me straight  
I'm just a small town girl who wants to give it a whirl  
While my looks still hold me straight  
  
Straight up to illusion and fantasy's fusion  
Of reality mixed with drink  
I'm just a small town girl who's gonna give life a whirl  
Looking at the Brandenburg Gate  
  
Small town giving it a whirl  
Brandenburg Gate  
Small town girl  
Small town girl

"
5,Metallica,Creeping Death,"Slaves  
Hebrews born to serve, to the pharaoh  
Heed  
To his every word, live in fear  
Faith  
Of the unknown one, the deliverer  
Wait  
Something must be done, four hundred years  
So let it be written  
So let it be done  
I'm sent here by the chosen one  
So let it be written  
So let it be done  
To kill the first born pharaoh son  
I'm creeping death  
  
Now  
Let my people go, land of Goshen  
Go  
I will be with thee, bush of fire  
Blood  
Running red and strong, down the Nile  
Plague  
Darkness three days long, hail to fire  
  
So let it be written  
So let it be done  
I'm sent here by the chosen one  
So let it be written  
So let it be done  
To kill the first born pharaoh son  
I'm creeping death  
  
Die by my hand  
I creep across the land  
Killing first born man  
Die by my hand  
I creep across the land  
Killing first born man  
  
I  
Rule the midnight air the destroyer  
Born  
I shall soon be there, deadly mass  
I  
Creep the steps and floor final darkness  
Blood  
Lambs blood painted door, I shall pass  
  
So let it be written  
So let it be done  
I'm sent here by the chosen one  
So let it be written  
So let it be done  
To kill the first born pharaoh son  
I'm creeping death

"
6,Metallica,Cretin Hop,"There's no stoppin' the cretins from hoppin'  
You gotta keep it beatin' for all the hoppin' cretins  
  
Cretin! Cretin!  
  
I'm gonna go for a whirl with my cretin girl  
My feet won't stop doin' the Cretin Hop  
  
Cretin! Cretin!  
  
1-2-3-4 cretins wanna hop some more  
4-5-6-7 All good cretins go to heaven  
  
There's no stoppin' the cretins from hoppin'  
You gotta keep it beatin' for all the hoppin' cretins  
  
Cretin! Cretin!  
  
I'm gonna go for a whirl with my cretin girl  
My feet won't stop doin' the Cretin Hop  
  
Cretin! Cretin!  
  
1-2-3-4 cretins wanna hop some more  
4-5-6-7 All good cretins go to heaven

"
7,Metallica,Escape,"[Verse 1]  
Feel no pain, but my life isn't easy  
I know I'm my best friend  
No one cares, but I'm so much stronger  
I'll fight until the end  
To escape from the true false world  
Undamaged destiny  
Can't get caught in the endless circle  
Ring of stupidity  
  
[Chorus]  
Out for my own, out to be free  
One with my mind, they just can't see  
No need to hear things that they say  
Life is for my own to live my own way  
  
[Verse 2]  
Rape my mind and destroy my feelings  
Don't tell me what to do  
I don't care now, because I'm on my side  
And I can see through you  
Feed my brain with your so called standards  
Who says that I am not right  
Break away from your common fashion  
See through your blurry sight  
  
[Chorus]  
Out for my own, out to be free  
One with my mind, they just can't see  
No need to hear things that they say  
Life is for my own to live my own way  
  
[Outro]  
See them try to bring the hammer down  
No damn chains can hold me to the ground

"
8,Metallica,Fixxxer,"Yeah  
Dolls of voodoo all stuck with pins  
One for each of us and our sins  
So you lay us in a line  
Push your pins in make us humble  
Only you can tell in time  
If we fall or merely stumble  
But tell me  
Can you heal what father's done  
Or fix this hole in a mother's son  
Can you heal the broken worlds within  
Can you strip away so we may start again  
Tell me can you heal what father's done  
Or cut this rope and let us run  
Just when all seems fine and I'm pain free  
You jab another pin  
Jab another pin in me  
Yeah  
Mirror, mirror upon the wall  
Break the spell or become the doll  
See you sharpening the pins  
So the holes will remind us  
We're just the toys in the hands of another  
And in time the needles turn from shine to rust  
But tell me  
Can you heal what father's done  
Or fix this hole in a mother's son  
Can you heal the broken worlds within  
Can you strip away so we may start again  
Tell me, can you heal what father's done  
Or cut this rope and let us run  
Just when all seems fine and I'm pain free  
You jab another pin  
Jab another pin in me  
Jab it  
Blood for face  
Sweat for dirt  
Three X's for the stone  
To break this curse  
A ritual's due  
I believe I'm not alone  
Shell of shotgun  
Pint of gin  
Numb us up to shield the pins  
Renew our faith  
Which way we can  
To fall in love with life again  
To fall in love with life again  
To fall in love with life again  
To fall in love  
To fall in love  
To fall in love with life again  
So tell me  
Can you heal what father's done  
Or fix this hole in a mother's son  
Can you heal the broken worlds within  
Can you strip away so we may start again  
Yeah, tell me, can you heal what father's done  
Or cut this rope and let us run  
Just when all seems fine and I'm pain free  
You jab another pin  
Jab another pin in me  
Oh yeah  
No more pins in me, yeah  
No more, no more pins in me  
No more, no more pins in me  
No more, no more, no more  
No, no, no

"
9,Metallica,Frantic,"If I could have my wasted days back  
Would I use them to get back on track?  
Stop to warm at karmas burning  
Or look ahead, but keep on turning?  
  
Do I have the strength  
To know how I'll go?  
Can I find it inside  
To deal with what I shouldn't know?  
  
Could I have my wasted days back  
Would I use them to get back on track?  
  
You live it or lie it!  
  
My lifestyle determines my deathstyle  
  
Keep searching, keep on searching  
This search goes on, this search goes on  
  
Frantic tick tick tick tick tick tick tock  
Frantic tick tick tick tick tick tick tock  
  
I've worn out always being afraid  
An endless stream of fear that I've made  
Treading water full of worry  
This frantic tick tick talk of hurry  
  
Do I have the strength  
To know how I'll go?  
Can I find it inside  
To deal with what I shouldn't know  
  
Worn out always being afraid  
An endless stream of fear that I've made  
  
You live it or lie it!  
  
My lifestyle determines my deathstyle  
  
Keep searching, keep on searching  
This search goes on, this search goes on  
  
Frantic tick tick tick tick tick tick tock  
Frantic tick tick tick tick tick tick tock  
  
My lifestyle (Birth is pain)  
Determines by deathstyle (Life is pain)  
A rising tide (Death is pain)  
That pushes to the other side (It's all the same)

"
10,Metallica,Frustration,"Frustration  
In my lexicon of hate  
I see you with your portraiture  
Does he love you?  
Does he love you too?  
  
The brush strokes  
Kiss your breasts and toes  
I cry icicles in my stein  
The heartbeats flutter  
With an abnormal rhythm  
  
The pain shoots through my body  
A sword between my thighs  
I wish that I could kill you  
But I too love your eyes  
  
You're feeling less whore but you stimulate  
The hatred smolders in your eyes  
I'd drop to my knees in a second  
To salivate in your thighs  
  
But all I do is fall over  
I don't have the strength I once had  
In you and your prickless lover  
And his easel in his eyes  
  
I feel the pain creep up my leg  
Blood runs from my nose  
I puke my guts out at your feet  
You're more man than I  
To be dead to have no feeling  
To be dry and spermless like a girl  
I want so much to hurt you  
I want so much to hurt you  
I want so much to hurt you  
Marry me  
I want you as my wife  
  
Spermless like a girl  
More man than I  
More man than I  
  
Frustration  
In my lexicon of hate  
You're feeling less like a whore but you  
Stimulate  
  
All I do is fall over  
I don't have the strength I once had  
All I do is fall over  
I don't have the strength I once had  
  
I want you so much to hurt you  
I want so much to hurt you  
I want so much to hurt you  
I want you as a wife  
  
Frustration is my lexicon of hate  
Frustration is my lexicon of hate  
Fru fru frustration, my lexicon of hate  
  
I cry icicles  
Heartbeats flutter  
Abnormal rhythm  
I wish that I could kill you  
But I too love your eyes  
I want you as my wife  
I want you as my wife  
Spermless like a girl  
  
Lucky in feeling  
More man than I  
Marry me, marry me, marry me  
I want you as a wife  
Spermless like a girl  
Puking my guts at your feet  
More man than I  
Fru fru fru frustration  
Frustration

"
11,Metallica,Fuel,"Gimme fuel,  
Gimme fire,  
Gimme that which I desire,  
Ooh!  
  
Turn on...I see red  
Adrenaline crash and crash my head  
Nitro junkie, paint me dead  
And I see red  
  
One hundred plus through black and white  
War horse, warhead  
Fuck 'em man, white knuckles tight  
Through black and white  
  
Ohhh, on I burn,  
Fuel is pumping engines,  
Burning hard, loose and clean  
  
And I burn,  
Churning my direction,  
Quench my thirst with gasoline  
  
So gimme fuel,  
Gimme fire,  
Gimme that which I desire,  
  
Hey  
  
Turn on beyond the bone  
Swallow future, spit out home  
Burn your face upon the chrome  
Yeah!  
  
Take the corner, join the crash,  
Headlights, headlines  
Another junkie lives too fast  
Yeah lives way too fast, fast, fast, oohh-aye  
  
Ohhh, on I burn  
Fuel is pumping engines  
Burning hard, loose and clean  
  
And on I burn  
Churning my direction,  
Quench my thirst with gasoline  
  
So gimme fuel  
Gimme fire  
Gimme that which I desire  
  
Yeah-heah  
  
White knuckle tight!  
(solo)  
  
Gimme fuel...on I burn, on and on  
Gimme fire...on I burn, on and on  
My desire...  
  
Ohhh, on I burn  
Fuel is pumping engines  
Burning hard, loose and clean  
  
And I burn  
Churning my direction  
Quench my thirst with gasoline  
  
Gimme fuel  
Gimme fire  
Gimme that which I desire  
Ooh  
  
On I burn!

"
12,Metallica,Fuel For Fire,"Gimme fuel, gimme fire, gimme that which I desire!  
Turn on the dynamo, into the wild I go,  
No other place I know, I know.  
Turn on I see red,  
Warhorse, Warhead,  
Throttle up for speed ahead, yeah ahead.  
CHORUS:  
Ooooh, on I burn,  
Fuel these pumping engines,  
Burning hard, loose and clean,  
And on I burn, turning my direction,  
Quench my thirst with gasoline.  
Gimme fuel, gimme fire, gimme that which I desire,  
Can't fight the need for speed,  
I'm loose, I'm clean, I'm burning lean and mean, and mean.  
Ignite the open trail,  
Excite, exhale, comin' on, hot from hell, yeah hot from hell.  
CHORUS  
Gimme fuel, gimme fire, gimme that which I desire,  
Oooh, yeah-heh.  
SOLO1  
On I burn!  
SOLO2  
On, and on, and on...  
Give me fuel,  
On, and on, and on...  
Give me fire,  
On, and on, and on...  
My desire,  
On, and on, and on...  
CHORUS  
Gimme fuel, gimme fire, gimme that which I desire!  
FUEL!

"
13,Metallica,Green Hell,"Originally performed by The Misfits  
Here in this place lies the key to your death  
Touch it, see it  
Here in this place is the means to your end  
Touch it, feel it  
Green hell  
  
You did your best as someone could  
I bet you never knew you would  
Did you run away from it?  
I bet you thought you were really good  
  
We're gonna burn in hell  
Green Hell Green Hell  
Like every hell but kind of green  
Green Hell Green Hell  
Try let me get back up there  
Green Hell Green Hell  
Feel it burning in your cereal  
Green Hell Green Hell  
Throw our fuckin' friends inside  
Green Hell Green Hell  
Gotta fuckin' pay and you must stay  
Green Hell Green Hell  
Cannot forget about the best  
Green Hell Green Hell  
Hell is reigning in your blood  
Green Hell Green Hell  
Gotta burn it all  
Green hell  
  
You did your best as someone could  
I bet you never knew you would  
And did you run away from me  
I bet you think they were really good  
  
Here in this place lies the key to your death  
Touch it, see it  
Here in this place sister won't let it in  
Touch it, feel it  
Green hell  
  
You did your best as someone could  
I bet you'd never knew you would  
Did you run away from it?  
I bet you thought you were really good  
You've come to this as someone told  
I bet you'd never knew you would  
Gonna bring  
Green hell

"
14,Metallica,Hardwired,"In the name of desperation  
In the name of wretched pain  
In the name of all creation  
Gone insane  
  
We're so fucked  
Shit out of luck  
Hardwired to self destruct  
Go!  
  
On the way to paranoia  
On the crooked borderline  
On the way to great destroyer  
Do you decide?  
  
We're so fucked  
Shit out of luck  
Hardwired to self destruct  
  
Once upon a planet burning  
Once upon a flame  
Once upon a fear returning  
All in vain  
  
Do you feel my hope receding?  
Do you comprehend?  
Do you feel it terminating in the end?  
  
We're so fucked  
Shit out of luck  
Hardwired to self destruct  
Hardwired to self destruct  
Self-destruct  
Self-destruct  
Self-destruct

"
15,Metallica,Harvester Of Sorrow,"My life suffocates  
Planting seeds of hate  
I've loved, turned to hate  
Trapped far beyond my fate  
I give  
You take  
This life that I forsake  
Been cheated of my youth  
You turned this lie to truth  
  
Anger  
Misery  
You'll suffer unto me  
  
Harvester of sorrow  
Language of the mad  
Harvester of sorrow  
  
Pure black looking clear  
My work is done soon here  
Try getting back to me  
Get back which used to be  
Drink up  
Shoot in  
Let the beatings begin  
Distributor of pain  
Your loss becomes my gain  
  
Anger  
Misery  
You'll suffer unto me  
  
Harvester of sorrow  
Language of the mad  
Harvester of sorrow  
  
All have said their prayers  
Invade their nightmares  
See into my eyes  
You'll find where murder lies  
  
Infanticide  
  
Harvester of sorrow  
Language of the mad  
Harvester of sorrow  
Language of the mad  
Harvester of sorrow

"
16,Metallica,Helpless,"(Originally recorded by Diamond Head)  
  
[Hmm-hm-hm-hm-hmm-m  
Hm-hm-hm-hm-hm]  
  
I've gotta see you moving fast, see you come my way  
See the dreams, I hope they last, never fade away  
Gotta see the lights above, make it loud tonight  
Gotta set it all afire, set it all alight  
  
See the flashing lights, hear the thunder roar  
I am gonna set you all alight  
Gotta make it man  
I ain't got a choice  
Gotta fill this hall tonight  
  
Helpless (helpless)  
Helpless (helpless)  
Helpless (helpless)  
Helpless (helpless)  
  
I don't know what I'm gonna do, maybe not tonight  
Gotta set you all afire, gotta treat you right  
I can see the flashing lights, lit before your love  
Gotta hear the thunder roar, coming from above  
  
See the flashing lights, hear the thunder roar  
I am gonna set you all alight  
Gotta make it man, I ain't got a choice  
Gotta fill this hall tonight  
  
Helpless (helpless)  
Helpless (helpless)  
Helpless (helpless)  
Helpless (helpless)  
Huh!  
  
I can see the stars, but I can't see what's going on  
Every night alone I sing my song just for fun  
Only time will tell if I'll make it myself someday  
This stage is mine, music is my destiny  
  
Cannot squeeze the life from me, yeah  
  
I can see the stars, but I can't see what's going on  
Every night alone I sing my song just for fun  
Only time will tell if I'll make it myself someday  
This stage is mine, music is my destiny  
  
Cannot squeeze the life from me  
Yeah-yeah-yeah  
  
Hoh!  
  
[See ya  
Keep it going and keep it ringing out, let it ring out  
Hey, doc  
Okay, turn it off now]

"
17,Metallica,Hero Of The Day,"Mama, they try and break me.  
The window burns to light the way back home  
A light that warms no matter where they've gone.  
They're off to find the hero of the day  
But what if they should fall by someone's wicked way?  
Still the window burns, time so slowly turns  
Someone there is sighing  
Keepers of the flames  
Do you feel your names?  
Do you hear your babies crying?  
Mama they try and break me  
Still they try and break me  
'Scuse me while I tend to how I feel  
These things return to me that still seem real  
Now deservingly this easy chair  
But the rocking stops by wheels of despair  
Don't want your aid  
But the fist I've made for years won't hold or feel  
No I'm not all me  
So please excuse me while I tend to how I fell  
But now the dreams and waking screams that ever last through the night (echoed
between James and Jason)  
  
So build the wall behind it crawl and hide until it's light  
Can you hear your babies crying now?  
Still the window burns  
Time so slowly turns  
And someone there is sighing  
Keepers of the flames, can't you feel your names?  
Can't you hear your babies crying?  
But now the dreams and waking screams that  
Ever last the night  
So build a wall behind it crawl  
And hide until it's light  
So can't you hear your babies crying now?  
Mama they try and break me  
Mama they try and break me  
Mama they try and break me  
Mama they try mama they try  
Mama they try and break me  
Mama they try and break me  
Mama they try and break me  
Mama they try and break me  
Mama they try and break me  
Mama they try and break me  
Mama they try Mama they try

"
18,Metallica,- Human,"Don't you leave me Father Time  
Take me with you  
Tell me does your sun still shine  
Come squeeze the world and drip it down my throat...oh yeah  
Down my throat again...woooah  
  
You got to breathe man, breathe!  
Coming up for air  
Breathe man, breathe!  
Coming up for air  
  
Touch me so I think I'm here  
Skin my senses  
Barely breathing  
Minus human  
Please squeeze the world and drip it down my throat again  
Down my throat again...woooah  
  
You got to breathe man, breathe!  
Coming up for air  
Breathe man, breathe!  
Coming up for air  
  
You got to breathe man, breathe!  
Coming up for air  
Breathe man, breathe!  
Coming up for!

"
