,0,1,2
74,Metallica,Through The Never,"All that is, was and will be  
Universe much too big to see  
Time and space never ending  
Disturbing thoughts, questions pending  
Limitations of human understanding  
Too quick to criticize  
Obligation to survive  
We hunger to be alive  
  
All that is, ever  
Ever was  
Will be ever  
Twisting  
Turning  
Through the never  
  
In the dark, see past our eyes  
Pursuit of truth no matter where it lies  
Gazing up to the breeze of the heavens  
On a quest, meaning, reason  
Came to be, how it begun  
All alone in the family of the sun  
Curiosity teasing everyone  
On our home, third stone from the sun  
  
All that is, ever  
Ever was  
Will be ever  
Twisting  
Turning  
Through the never  
On through the never  
  
We must go  
On through the never  
Out of the  
Edge of forever  
We must go  
On through the never  
Then ever comes  
  
All that is, ever  
Ever was  
Will be ever  
Who we are  
Ask forever  
Twisting  
Turning  
Through the never  
Never

"
75,Metallica,"Today Your Love, Tomorrow The World","I'm a shock trooper in a stupor  
Yes I am.  
I'm a Nazi schatze  
Why'know I fight for fatherland.  
  
I'm a shock trooper in a stupor  
Yes I am.  
I'm a Nazi schatze  
Why'know I fight for fatherland.  
  
Little German boy  
Being pushed around  
Little German boy  
In a German town.  
  
I'm a shock trooper in a stupor  
Yes I am.  
I'm a Nazi schatze  
Why'know I fight for fatherland.  
  
I'm a shock trooper in a stupor  
Yes I am.  
I'm a Nazi schatze  
Why'know I fight for fatherland.  
  
Little German boy  
Being pushed around  
Little German boy  
In a German t...  
  
Today your love, tomorrow the world.

"
76,Metallica,Too Late Too Late,"I see that nothin's safe  
Insist on playing games  
Some waste their time and more  
I am still popular  
Permission since you fix  
I got to gas -- get  
Or just another job  
Oh no surly not  
  
Your rude, but you're absolute  
Stalemate, ahh too late, too late  
  
I thought you were for real  
Just won the river deal  
Don't give me all that crap  
I just escaped your trap  
But didn't you see the joke  
Then you're just chasin' smoke  
You found another one  
An old story's done  
  
Your rude, but you're absolute  
Stalemate, ahh too late, too late  
  
Misunderstanding me  
The way you felt so free  
I'm gonna jump the gun  
I'm gonna cut an' run  
You're gonna do it see  
I've got no ice in me  
And now the thrill is gone  
An old story's done  
  
Your rude, but you're absolute  
Stalemate, ahh too late, too late  

"
77,Metallica,Trapped Under Ice,"I don't know how to live trough this hell  
Woken up, I'm still locked in this shell  
Frozen soul, frozen down to the core  
Break the ice, I can't take anymore  
  
Freezing  
Can't move at all  
Screaming  
Can't hear my call  
I am dying to live  
Cry out  
I'm trapped under the ice  
  
Crystallized, as I lay here and rest  
Eyes of glass stare directly at death  
From deep sleep I have broken away  
No one knows, no one hears what I say  
  
Freezing  
Can't move at all  
Screaming  
Can't hear my call  
I am dying to live  
Cry out  
I'm trapped under the ice  
  
Scream from my soul  
Fate, mystified  
Hell, forever more  
  
No release from my cryonic state  
What is this? I've been stricken by fate  
Wrapped up tight, cannot move, can't break free  
Hand of doom has a tight grip on me  
  
Freezing  
Can't move at all  
Screaming  
Can't hear my call  
I am dying to live  
Cry out  
I'm trapped under the ice

"
78,Metallica,Tuesday's Gone,"Hey, you guys ready?  
One, two, three, one, two, three  
  
Train roll on, on down the line,  
Won't you please take me far, far away.  
Now I feel the wind blow, outside my door,  
I'm leavin' my woman at home, oh yeah.  
My baby's gone  
Tuesday's gone with the wind,  
My baby's gone, gone with that wind  
Long Gone (Gary)  
  
(Pepper)  
And I don't know, oh, where I'm goin'.  
I just want to be left alone.  
When this train ends, I'll try again.  
I'm leavin' my woman at home.  
My baby's gone  
  
Tuesday's gone with the wind. (oh yeah)  
Tuesday's gone with the wind.  
Tuesday's gone with the wind.  
My baby's gone, with the wind.  
Train roll on (Jean paul)  
  
Tuesday's gone with the wind.  
Tuesday's gone with the wind.  
Tuesday's gone with the wind.  
My baby's gone, with the wind.  
  
Train roll on  
Train roll on many miles from my home,  
See I'm, I'm ridin' my blues, babe, blues away, yeah.  
But Tuesday you see, oh, she had to be free.  
Somehow I got to, to carry on.  
My baby's gone.  
  
Tuesday's gone with the wind.  
Tuesday's gone with the wind. (Tuesday's gone)  
Tuesday's gone with the wind.  
My baby's gone, with the wind.  
  
Train roll on, train roll on  
Ride on train, ride on train, ride on train  
Train roll on, (train rolls on)  
The train, it rolls on  
  
Train rolls on (train rolls on)  
Lord, I can't change (I can't change)  
Lord, I can't change (I can't change)  
Lord, I can't change  
Lord, I can't change (I can't change)  
Train roll on  
Ride on train  
I can't change  
Train roll on  
Ride on train  
Lord, I can't change, no  
I can't change  
Ride on Train  
  
Thanks Gar,(right on) thanks pop, thanks Pat, thanks Ger  
Thank you Het  
Thanks Les, thanks Fatso (thank you everyone)(that was nice)  
Thank ya. thank ya, thank ya, thank ya everybody  
(Hey, let's, let's do that again)

"
79,Metallica,Unforgiven,"New blood joins this earth  
And quickly he's subdued  
Through constant pain disgrace  
The young boy learns their rules  
With time the child draws in  
This whipping boy done wrong  
Deprived of all his thoughts  
The young man struggles on and on he's known  
A vow unto his own  
That never from this day  
His will they'll take away  
  
What I've felt  
What I've known  
Never shined through in what I've shown  
Never be  
Never see  
Won't see what might have been  
What I've felt  
What I've known  
Never shined through in what I've shown  
Never free  
Never me  
So I dub thee unforgiven  
  
They dedicate their lives  
To running all of his  
He tries to please them all  
This bitter man he is  
Throughout his life the same  
He's battled constantly  
This fight he cannot win  
A tired man they see no longer cares  
The old man then prepares  
To die regretfully  
That old man here is me  
  
What I've felt  
What I've known  
Never shined through in what I've shown  
Never be  
Never see  
Won't see what might have been  
What I've felt  
What I've known  
Never shined through in what I've shown  
Never free  
Never me  
So I dub thee unforgiven  
  
What I've felt  
What I've known  
Never shined through in what I've shown  
Never be  
Never see  
Won't see what might have been  
What I've felt  
What I've known  
Never shined through in what I've shown  
Never free  
Never me  
So I dub thee unforgiven  
  
Never free  
Never me  
So I dub thee unforgiven  
  
You labeled me  
I labeled you  
So I dub thee unforgiven  
  
Never free  
Never me  
So I dub thee unforgiven  
  
You labeled me  
I labeled you  
So I dub thee unforgiven  
  
Never free  
Never me  
So I dub thee unforgiven

"
80,Metallica,Unforgiven 2,"Lay beside me  
Tell me what they've done  
Speak the words I want to hear  
To make my demons run  
The door is locked now  
But it's open if you're true  
If you can understand the me  
Then I can understand the you  
Lay beside me  
Under wicked sky  
The black of day  
Dark of night  
We share this paralyze  
The door cracks open  
But there's no sun shining through  
Black heart scarring darker still  
But there's no sun shining through  
No, there's no sun shining through  
No, there's no sun shining  
What I've felt  
What I've known  
Turn the pages  
Turn the stone  
Behind the door  
Should I open it for you?  
Yeah  
What I've felt  
What I've known  
Sick and tired  
I stand alone  
Could you be there  
'Cause I'm the one who waits for you  
Or are you unforgiven too?  
Come lay beside me  
This won't hurt, I swear  
She loves me not  
She loves me still  
But she'll never love again  
She lay beside me  
But she'll be there when I'm gone  
Black heart scarring darker still  
Yes, she'll be there when I'm gone  
Yes, she'll be there when I'm gone  
Dead sure she'll be there  
What I've felt  
What I've known  
Turn the pages  
Turn the stone  
Behind the door  
Should I open it for you?  
Yeah  
What I've felt  
What I've known  
Sick and tired  
I stand alone  
Could you be there  
'Cause I'm the one who waits for you  
Or are you unforgiven too?  
Lay beside me  
Tell me what I've done  
The door is closed, so are your eyes  
But now I see the sun  
Now I see the sun  
Yes, now I see it  
What I've felt  
What I've known  
Turn the pages  
Turn the stone  
Behind the door  
Should I open it for you?  
Yeah  
What I've felt  
What I've known  
So sick and tired  
I stand alone  
Could you be there  
'Cause I'm the one who waits  
The one who waits for you  
Oh  
What I've felt  
What I've known  
Turn the pages  
Turn the stone  
Behind the door  
Should I open it for you?  
So I dub thee unforgiven  
Oh, what I've felt  
Oh, what I've known  
I take this key  
And I bury it in you  
Because you're unforgiven too  
Never free  
Never me  
'Cause you're unforgiven too  
Oh

"
81,Metallica,Unnamed Feeling,"Been here before (x6)  
  
Been here before, couldn't say I liked it  
Do I start writing all this down?  
Just let me plug you into my world  
Can't you help me be uncrazy?  
  
Name this for me, heat the cold air  
Take the chill off of my life  
And if I could I'd turn my eyes  
To look inside to see what's comin'  
  
It comes alive...  
It comes alive...  
It comes alive  
And I die a little more  
It comes alive...  
It comes alive...  
It comes alive  
Each moment here I die a little more  
  
Then the unnamed feeling  
It comes alive  
Then the unnamed feeling  
Takes me away  
  
Been here before (x6)  
  
I'm frantic in your soothing arms  
I can not sleep in this down filled world  
I've found safety in this loneliness  
But I can not stand it anymore  
  
Cross my heart, hope not to die  
Swallow evil, ride the sky  
Lose myself in a crowded room  
You fool, you fool, it'll be here soon  
  
It comes alive...  
It comes alive...  
It comes alive  
And I die a little more  
It comes alive...  
It comes alive...  
It comes alive  
Each moment here I die a little more  
  
Ooh, I die, I die, I die a little more  
  
Then the unnamed feeling  
It comes alive  
Then the unnamed feeling  
Treats me this way  
And I wait for this train  
Toes over the line  
And then the unnamed feeling  
Takes me away  
...Takes me  
  
Then the unnamed feeling  
It comes alive  
Then the unnamed feeling  
Takes me away  
...Takes me away!  
  
Then the unnamed feeling  
It comes alive  
Then the unnamed feeling  
Treats me this way  
And I wait for this train  
Toes over the line  
And then the unnamed feeling  
Takes me away  
...Takes me away!  
  
Then the unnamed feeling  
It comes alive  
Then the unnamed feeling  
Takes me away  
  
Get the fuck out of here  
I just want to get the fuck away from me  
I rage, I glaze, I hurt, I hate  
I hate it all, Why? Why? Why me?  
  
I cannot sleep with a head like this  
I want to cry, I want to scream  
I rage, I glaze, I hurt, I hate  
I want to hate it all away

"
82,Metallica,Until It Sleeps,"Where do I take this pain of mine  
I run, but it stays right my side  
  
So tear me open, pour me out  
There's things inside that scream and shout  
And the pain still hates me  
So hold me, until it sleeps  
  
Just like the curse, just like the stray  
You feed it once, and now it stays  
  
So tear me open, but beware  
There's things inside without a care  
And the dirt still stains me  
So wash me, until I'm clean  
  
It grips you, so hold me  
It stains you, so hold me  
It hates you, so hold me  
It holds you, so hold me  
  
Until it sleeps  
  
So tell me why you've chosen me  
Don't want your grip, don't want your greed  
  
I'll tear me open, make you gone  
No more can you hurt anyone  
And the fear still shakes me  
So hold me, until it sleeps  
  
It grips you, so hold me  
It stains you, so hold me  
It hates you, so hold me  
It holds you, so hold me  
  
Until it sleeps  
  
I don't want it  
  
So tear me open, but beware  
The things inside without a care  
And the dirt still stains me  
So wash me, 'till I'm clean  
  
I'll tear me open, make you gone  
No longer will you hurt anyone  
And the fear still shapes me  
So hold me, until it sleeps  
  
Until it sleeps

"
83,Metallica,Wasted My Hate,"Good day, how do  
And I send a smile to you  
Don't waste, waste your breath  
And I won't waste my hate on you  
Hate, yeah  
  
Ain't gonna waste my hate  
Ain't gonna waste my hate on you  
I think I'll keep it for myself  
  
Ain't gonna give no more  
Ain't got the time to help you score  
I think it's time you pleased yourself, yourself  
  
Good day, how do  
And I send a smile to you  
Don't waste, waste your breath  
And I won't waste my hate on you  
Waste my hate on you, hate  
  
Think you're worthy now?  
Think enough to even raise the brow  
And to laugh and tip that two pronged crown  
  
Well, I see my hands I see my feet  
I feel that blood that pumps in me  
But where the hell's my mind goin' now? Get goin' now  
  
Good day, how do  
And I send a smile to you  
Don't waste, waste your breath  
And I won't waste my hate on you  
Waste my hate on you  
Think I'll keep it for myself, hate  
  
Ain't gonna waste my hate  
But I'm so greedy when they say  
Better to give than to receive  
  
Ain't gonna waste my hate, oh no  
Ain't got time to waste my hate on you  
I think I'll keep it all for myself  
For myself  
  
Good day, how do  
And I send a smile to you  
Don't waste, waste your breath  
And I won't waste my hate on you  
Waste my hate on you  
Think I'll keep it for myself, hate

"
84,Metallica,We Did It Again,"Ow  
Yeah we did it  
(It's on fire)  
Yeah, we did it  
(We are ready to rock this)  
Yeah, we did it  
(Uh uh ye got Metallica, in here)  
Yeah, we did it  
(Ja rule,Swiss the Monster)  
Let's go  
Just when you thought it was over  
Just when you thought we were done  
Just when you thought it was safe now  
We did it, did it again  
Just when you thought it was over  
Just when you thought we were done  
Just when you thought it was safe now  
We did it, did it again  
I love fast cars, fast brauds  
'Cause I'm a rockstar, baby  
Born in the U.S.A  
I'm gonna hit the highway on my Harley, do about 38  
Nothin' else but take it easy  
Any woman that won't please me, I'll give her up  
Anythin' that won't touch or move me, I'll give it up  
And I know you're all serious  
We did it, did it again  
More than this, nevermore you whippin' boy  
Yeah, we did it  
More than this, nevermore you whippin' boy  
Yeah, we did it, let's go  
Just when you thought it was over  
Just when you thought we were done  
Just when you thought it was safe now  
We did it, did it again  
Just when you thought it was over  
Just when you thought we were done  
Just when you thought it was safe now  
We did it, did it again  
Who loves a little rock and roll  
Mixed with a little bit of hip hop soul? We do  
Come one on a rock steady, keep you rockin'  
Get ready and say we did it, we did it again  
Believe in the air you breathin'  
I'm a mad work freak with a freaky weekend  
No matter what you spend 'cause your just livin' it up  
And damn, if we don't do it again  
Come on in, baby bring some friends  
We havin' a party, tonight  
I'm bringing juice and gin, you'll beat your head  
Swiss we did it, did it again  
More than this, nevermore you whippin' boy  
Yeah, we did it  
More than this, nevermore you whippin' boy  
Yeah we did it, let's go  
Just when you thought it was over  
Just when you thought we were done  
Rip that smile right off your face  
Just when you thought it was over  
Just when you thought we were done  
Rip that smile right off your face  
Fast cars, fast brauds  
I'm a rockstar, baby  
Born in the U.S.A  
Highway, Harley  
Who loves a little rock and roll  
Mixed with a little bit of hip hop soul  
We do, we do  
Now break it down, break it down  
More than this, nevermore you whippin' boy  
Yeah, we did it  
More than this, nevermore you whippin' boy  
Yeah, we did it, let's go  
Just when you thought it was over  
Just when you thought we were done  
Just when you thought it was safe now  
Yeah, we did it, did it again  
Just when you thought it was over  
Just when you thought we were done  
Just when you thought it was safe now  
Yeah, we did it, did it again  
Yeah, you know about that time  
Rip that smile right off your face  
Rip that smile right off your face  
Rip that smile right off your face  
Rip that smile right off your face  
Rip that smile right off your face  

"
85,Metallica,Welcome Home (Sanitarium),"Welcome to where time stands still  
No one leaves and no one will  
Moon is full, never seems to change  
Just labeled mentally deranged  
Dream the same thing every night  
I see our freedom in my sight  
No locked doors, no windows barred  
No things to make my brain seem scarred  
  
Sleep my friend and you will see  
That dream is my reality  
They keep me locked up in this cage  
Can't they see it's why my brain says rage  
  
Sanitarium, leave me be  
Sanitarium, just leave me alone  
  
Build my fear of what's out there  
And cannot breathe the open air  
Whisper things into my brain  
Assuring me that I'm insane  
They think our heads are in their hands  
But violent use brings violent plans  
Keep him tied, it makes him well  
He's getting better, can't you tell?  
  
No more can they keep us in  
Listen, damn it, we will win  
They see it right, they see it well  
But they think this saves us from our Hell  
  
Sanitarium, leave me be  
Sanitarium, just leave me alone  
Sanitarium, just leave me alone  
  
Fear of living on  
Natives getting restless now  
Mutiny in the air  
Got some death to do  
Mirror stares back hard  
Kill, it's such a friendly word  
Seems the only way  
For reaching out again.

"
86,Metallica,Where The Wild Things Are,"So wake up sleepy one  
It's time to save your world  
Steal dreams and give to you  
Shop lift a thought or two  
All children touch the sun  
Burn fingers one by one  
By one  
Will this earth be good to you?  
Keep you clean or stain through?  
So wake up sleepy one  
It's time to save your world  
You're where the wild things are  
Yeah  
Toy soldiers off to war  
Big eyes to open too  
Believing now under sun and moon  
But does heaven know you're here?  
And did they give you smiles or tears?  
No, no tears  
Will this earth be good to you?  
Keep you clean or stain through?  
So wake up sleepy one  
It's time to save your world  
You're where the wild things are  
Yeah  
Toy soldiers off to war  
You swing your ass all down  
Call to arms, a trumpet's sound  
Toy horses start the charge  
Robots, chessmen standing guard  
We shall never surrender  
All you children touch the sun  
Burn your fingers one by one  
Will this earth be good to you?  
Keep you clean or stain through?  
So wake up sleepy one  
It's time to save your world  
You're where the wild things are  
Yeah  
Toy soldiers off to war  
Off to war  
Off to war  
So close your little eyes

"
87,Metallica,Am I Evil?,"My mother was a witch, she was burned alive.  
Thankless little bitch, for the tears I cried.  
Take her down now, don't want to see her face  
All blistered and burnt, can't hide my disgrace.  
  
Twenty-seven, everyone was nice.  
Gotta see 'em make 'em pay the price.  
See their bodies out on the ice.  
Take my time.  
  
Am I evil? Yes I am.  
Am I evil? I am man, yes I am.  
  
As I watched my mother die, I lost my head.  
Revenge now I sought, to break with my bread.  
Taking no chances, you come with me.  
I'll split you to the bone, help set you free.  
  
Twenty-seven, everyone was nice.  
Gotta see 'em make 'em pay the price.  
See their bodies out on the ice.  
Take my time.  
  
Am I evil? Yes I am.  
Am I evil? I am man, yes I am.  
  
On with the action now, I'll strip your pride.  
I'll spread your blood around, I'll see you ride.  
Your face is scarred with steel, wounds deep and neat.  
Like a double dozen before ya, smells so sweet.  
  
Am I evil? Yes I am.  
Am I evil? I am man.  
  
I'll make my residence, I'll watch your fire.  
You can come with me, sweet desire.  
My face is long forgot, my face not my own  
Sweet and timely whore, take me home.  
  
Am I evil? Yes I am.  
Am I evil? I am man.  
  
My soul is longing for, await my heir.  
Sent to avenge my mother, sweep myself.  
My face is long forgot, my face not my own.  
Sweet and timely whore, take me home.  
  
Am I evil? Yes I am.  
Am I evil? I am man.  
  
Am I evil? Yes I fucking am.  
Am I evil? I am man, yeah.

"
88,Metallica,Am I Savage?,"Ooooh  
Run away, the past will bite again  
Ooooh  
No matter where you dwell  
You  
Here again, a captive of the howl  
You  
Welcome back to hell  
  
Faithful, as the full moon is rising  
Beauty and the Beast are colliding  
  
Sharpened edge touch liquid flame  
Deepened seed soaks anger's reign  
Arching back, shape-shift derange  
Father, how I watched you change  
  
Am I savage?  
Scratching at the door  
Am I savage?  
I don't recognize you anymore  
  
Ooooh  
Tooth is fang, twisting under skin  
Ooooh  
Foul tongue, black breath  
Change  
Snap inside, the Beast about complete  
Change  
Soon infects the rest  
  
Faithful, as the full moon is rising  
Beauty and the Beast are colliding  
  
Sharpened edge touch liquid flame  
Deepened seed soaks anger's reign  
Arching back, shape-shift derange  
Father, how I watched you change  
  
Am I savage?  
Howling at the door  
Am I savage?  
I don't recognize you anymore  
Anymore  
  
Ooooh  
Inheritance, the past has bit again  
Ooooh  
The next heir of anarchy  
Feel  
Stretching skin so far beyond belief  
I feel  
The ever changing, you, in me  
  
Am I savage?  
Scratching at the door  
Am I savage?  
Howling evermore  
Am I savage?  
I don't recognize me anymore  
Anymore  
  
Anymore, ha ha ha  
Am I savage?

"
89,Metallica,...And Justice For All,"Halls of justice painted green  
Money talking  
Power wolves beset your door  
Hear them stalking  
Soon you'll please their appetite  
They devour  
Hammer of justice crushes you  
Overpower  
  
The ultimate in vanity  
Exploiting their supremacy  
I can't believe the things you say  
I can't believe  
I can't believe the price you pay  
Nothing can save you  
  
Justice is lost  
Justice is raped  
Justice is gone  
Pulling your strings  
Justice is done  
Seeking no truth  
Winning is all  
Find it so grim  
So true  
So real  
  
Apathy their stepping stone  
So unfeeling  
Hidden deep animosity  
So deceiving  
Through your eyes their light burns  
Hoping to find  
Inquisition sinking you  
With prying minds  
  
The ultimate in vanity  
Exploiting their supremacy  
I can't believe the things you say  
I can't believe  
I can't believe the price you pay  
Nothing can save you  
  
Justice is lost  
Justice is raped  
Justice is gone  
Pulling your strings  
Justice is done  
Seeking no truth  
Winning is all  
Find it so grim  
So true  
So real  
  
Lady justice has been raped  
Truth assassin  
Rolls of red tape seal your lips  
Now you're done in  
Their money tips her scales again  
Make your deal  
Just what is truth?I cannot tell  
Cannot feel  
  
The ultimate in vanity  
Exploiting their supremacy  
I can't believe the things you say  
I can't believe  
I can't believe the price we pay  
Nothing can save you  
  
Justice is lost  
Justice is raped  
Justice is gone  
Pulling your strings  
Justice is done  
Seeking no truth  
Winning is all  
Find it so grim  
So true  
So real  
Seeking no truth  
Winning is all  
Find it so grim  
So true  
So real

"
90,Metallica,Astronomy,"Clock strikes twelve and moon drops burst  
Out at you from their hiding place  
Like acid and oil on a madman's face  
His reasons tend to fly away  
Like lesser birds on the four winds, yeah  
Like silver scrapes in May  
Now the sands become a crust  
And most of you have gone away (hm, yeah gone away)  
  
Come Susy dear, let's take a walk  
Just out there upon the beach  
I know you'll soon be married  
And you want to know where the winds come from  
Well it's never said at all  
On the map that Carrie reads  
Behind the clock back there you know  
At the four winds bar (hm, yeah)  
  
Hey, hey, hey, hey  
Four winds at the four winds bar  
Two doors locked and windows barred  
One door let to take you in  
The other one just mirrors it  
Hey, hey, yeah! hey, hey  
In hellish glare and inference  
The other one's a duplicate  
The queenly flux, eternal light  
Or the light that never warms  
Yes the light, that never, never warms  
Yes the light, that never, never warms  
Never warms, never warms  
  
The clock strikes twelve and moon drops burst  
Out at you from their hiding place  
Miss Carrie nurse and Suzy dear  
Would find themselves at the four winds bar  
It's the nexus of the crisis  
The origin of storms  
Just the place to hopelessly  
Encounter time and then came me  
  
Hey, hey, hey, hey  
  
Call me Desdenova, eternal light  
These gravely digs of mine  
Will surely prove a sight  
And don't forget my dog, fixed and consequent  
  
Astronomy, a star  
Astronomy, a star  
Astronomy, a star  
Astronomy, a star  
  
Astronomy

"
